{"schema":"mr.catalog/1","version":"2026-09-27T040000Z","restrictions":["standard_ban_list_26_05","standard_balance_update_26_08"],"cards":[{"id":"a_teia_ip_recovery","title":"A Teia: IP Recovery","side":"corp","type":"corp_identity","faction":"jinteki","printings":["34039"],"legal_in":["standard_ban_list_26_05","standard_balance_update_26_08"]},{"id":"abaasy","title":"Abaasy","side":"runner","type":"program","faction":"anarch","printings":["33070"],"legal_in":["standard_ban_list_26_05","standard_balance_update_26_08"]},{"id":"ablative_barrier","title":"Ablative Barrier","side":"corp","type":"ice","faction":"haas_bioroid","printings":["34034"],"legal_in":["standard_ban_list_26_05","standard_balance_update_26_08"]},{"id":"above_the_law","title":"Above the Law","side":"corp","type":"agenda","faction":"weyland_consortium","printings":["30060"],"legal_in":["standard_ban_list_26_05","standard_balance_update_26_08"]},{"id":"aggressive_trendsetting","title":"Aggressive Trendsetting","side":"corp","type":"agenda","faction":"haas_bioroid","printings":["35037"],"legal_in":["standard_ban_list_26_05","standard_balance_update_26_08"]},{"id":"airbladex_jsrf_ed","title":"AirbladeX (JSRF Ed.)","side":"runner","type":"hardware","faction":"shaper","printings":["34022"],"legal_in":["standard_ban_list_26_05","standard_balance_update_26_08"]},{"id":"aircheck","title":"Aircheck","side":"runner","type":"event","faction":"shaper","printings":["36018"],"legal_in":["standard_ban_list_26_05","standard_balance_update_26_08"]},{"id":"akhet","title":"Akhet","side":"corp","type":"ice","faction":"weyland_consortium","printings":["26123"],"legal_in":["standard_ban_list_26_05","standard_balance_update_26_08"]},{"id":"alarm_clock","title":"Alarm Clock","side":"runner","type":"hardware","faction":"criminal","printings":["34078"],"legal_in":["standard_ban_list_26_05","standard_balance_update_26_08"]},{"id":"always_have_a_backup_plan","title":"Always Have a Backup Plan","side":"runner","type":"event","faction":"criminal","printings":["26011"],"legal_in":["standard_ban_list_26_05","standard_balance_update_26_08"]},{"id":"amanuensis","title":"Amanuensis","side":"runner","type":"hardware","faction":"anarch","printings":["34069"],"legal_in":["standard_ban_list_26_05","standard_balance_update_26_08"]},{"id":"amaze_amusements","title":"AMAZE Amusements","side":"corp","type":"upgrade","faction":"nbn","printings":["30058"],"legal_in":["standard_ban_list_26_05","standard_balance_update_26_08"]},{"id":"amelia_earhart","title":"Amelia Earhart","side":"runner","type":"resource","faction":"criminal","printings":["34083"],"legal_in":["standard_ban_list_26_05","standard_balance_update_26_08"]},{"id":"ampere_cybernetics_for_anyone","title":"Ampère: Cybernetics For Anyone","side":"corp","type":"corp_identity","faction":"neutral_corp","printings":["33128"],"legal_in":["standard_ban_list_26_05","standard_balance_update_26_08"]},{"id":"anemone","title":"Anemone","side":"corp","type":"ice","faction":"jinteki","printings":["32005","33043"],"legal_in":["standard_ban_list_26_05","standard_balance_update_26_08"]},{"id":"angelique_garza_correa","title":"Angelique Garza Correa","side":"corp","type":"upgrade","faction":"weyland_consortium","printings":["34063"],"legal_in":["standard_ban_list_26_05","standard_balance_update_26_08"]},{"id":"aniccam","title":"Aniccam","side":"runner","type":"hardware","faction":"shaper","printings":["26084"],"legal_in":["standard_ban_list_26_05","standard_balance_update_26_08"]},{"id":"ansel_1_0","title":"Ansel 1.0","side":"corp","type":"ice","faction":"haas_bioroid","printings":["30038"],"legal_in":["standard_ban_list_26_05","standard_balance_update_26_08"]},{"id":"ansel_2_0","title":"Ansel 2.0","side":"corp","type":"ice","faction":"haas_bioroid","printings":["36028"],"legal_in":["standard_ban_list_26_05","standard_balance_update_26_08"]},{"id":"anthill_excavation_contract","title":"Anthill Excavation Contract","side":"corp","type":"asset","faction":"weyland_consortium","printings":["35072"],"legal_in":["standard_ban_list_26_05","standard_balance_update_26_08"]},{"id":"anvil","title":"Anvil","side":"corp","type":"ice","faction":"weyland_consortium","printings":["33124"],"legal_in":["standard_ban_list_26_05","standard_balance_update_26_08"]},{"id":"architect_deployment_test","title":"Architect Deployment Test","side":"corp","type":"agenda","faction":"haas_bioroid","printings":["26032"],"legal_in":["standard_ban_list_26_05","standard_balance_update_26_08"]},{"id":"argus_crackdown","title":"Argus Crackdown","side":"corp","type":"operation","faction":"weyland_consortium","printings":["26126"],"legal_in":["standard_ban_list_26_05","standard_balance_update_26_08"]},{"id":"arissana_rocha_nahu_street_artist","title":"Arissana Rocha Nahu: Street Artist","side":"runner","type":"runner_identity","faction":"shaper","printings":["34020"],"legal_in":["standard_ban_list_26_05","standard_balance_update_26_08"]},{"id":"armed_asset_protection","title":"Armed Asset Protection","side":"corp","type":"operation","faction":"weyland_consortium","printings":["34061"],"legal_in":["standard_ban_list_26_05","standard_balance_update_26_08"]},{"id":"arruaceiras_crew","title":"Arruaceiras Crew","side":"runner","type":"resource","faction":"anarch","printings":["34073"],"legal_in":["standard_ban_list_26_05","standard_balance_update_26_08"]},{"id":"artificial_cryptocrash","title":"Artificial Cryptocrash","side":"corp","type":"agenda","faction":"nbn","printings":["33049"],"legal_in":["standard_ban_list_26_05","standard_balance_update_26_08"]},{"id":"asmund_pudlat","title":"Asmund Pudlat","side":"runner","type":"resource","faction":"criminal","printings":["33082"],"legal_in":["standard_ban_list_26_05","standard_balance_update_26_08"]},{"id":"attini","title":"Attini","side":"corp","type":"ice","faction":"jinteki","printings":["34042"],"legal_in":["standard_ban_list_26_05","standard_balance_update_26_08"]},{"id":"au_co_the_gold_standard_in_clones","title":"AU Co.: The Gold Standard in Clones","side":"corp","type":"corp_identity","faction":"jinteki","printings":["35046"],"legal_in":["standard_ban_list_26_05","standard_balance_update_26_08"]},{"id":"audrey_v2","title":"Audrey v2","side":"runner","type":"program","faction":"anarch","printings":["34004"],"legal_in":["standard_ban_list_26_05","standard_balance_update_26_08"]},{"id":"az_mccaffrey_mechanical_prodigy","title":"Az McCaffrey: Mechanical Prodigy","side":"runner","type":"runner_identity","faction":"criminal","printings":["26010"],"legal_in":["standard_ban_list_26_05","standard_balance_update_26_08"]},{"id":"azef_protocol","title":"Azef Protocol","side":"corp","type":"agenda","faction":"weyland_consortium","printings":["32007","33058"],"legal_in":["standard_ban_list_26_05","standard_balance_update_26_08"]},{"id":"azimat","title":"Azimat","side":"runner","type":"program","faction":"shaper","printings":["35029"],"legal_in":["standard_ban_list_26_05","standard_balance_update_26_08"]},{"id":"b_1001","title":"B-1001","side":"corp","type":"asset","faction":"neutral_corp","printings":["34065"],"legal_in":["standard_ban_list_26_05","standard_balance_update_26_08"]},{"id":"backstitching","title":"Backstitching","side":"runner","type":"resource","faction":"criminal","printings":["33019"],"legal_in":["standard_ban_list_26_05","standard_balance_update_26_08"]},{"id":"bahia_bands","title":"Bahia Bands","side":"runner","type":"event","faction":"neutral_runner","printings":["34030"],"legal_in":["standard_ban_list_26_05","standard_balance_update_26_08"]},{"id":"baker","title":"Baker","side":"runner","type":"program","faction":"criminal","printings":["36015"],"legal_in":["standard_ban_list_26_05","standard_balance_update_26_08"]},{"id":"balanced_coverage","title":"Balanced Coverage","side":"corp","type":"asset","faction":"nbn","printings":["34050"],"legal_in":["standard_ban_list_26_05","standard_balance_update_26_08"]},{"id":"ballista","title":"Ballista","side":"corp","type":"ice","faction":"weyland_consortium","printings":["30062"],"legal_in":["standard_ban_list_26_05","standard_balance_update_26_08"]},{"id":"bangun_when_disaster_strikes","title":"BANGUN: When Disaster Strikes","side":"corp","type":"corp_identity","faction":"weyland_consortium","printings":["35068"],"legal_in":["standard_ban_list_26_05","standard_balance_update_26_08"]},{"id":"banner","title":"Banner","side":"runner","type":"program","faction":"anarch","printings":["34005"],"legal_in":["standard_ban_list_26_05","standard_balance_update_26_08"]},{"id":"barry_baz_wong_tri_maf_veteran","title":"Barry “Baz” Wong: Tri-Maf Veteran","side":"runner","type":"runner_identity","faction":"criminal","printings":["35012"],"legal_in":["standard_ban_list_26_05","standard_balance_update_26_08"]},{"id":"basilar_synthgland_2kvj","title":"Basilar Synthgland 2KVJ","side":"runner","type":"hardware","faction":"shaper","printings":["33086"],"legal_in":["standard_ban_list_26_05","standard_balance_update_26_08"]},{"id":"bass_ch1r180g4","title":"Bass CH1R180G4","side":"corp","type":"asset","faction":"haas_bioroid","printings":["26098"],"legal_in":["standard_ban_list_26_05","standard_balance_update_26_08"]},{"id":"beatriz_friere_gonzalez","title":"Beatriz Friere Gonzalez","side":"runner","type":"resource","faction":"shaper","printings":["34028"],"legal_in":["standard_ban_list_26_05","standard_balance_update_26_08"]},{"id":"begemot","title":"Begemot","side":"runner","type":"program","faction":"anarch","printings":["33007"],"legal_in":["standard_ban_list_26_05","standard_balance_update_26_08"]},{"id":"biawak","title":"Biawak","side":"corp","type":"ice","faction":"weyland_consortium","printings":["35074"],"legal_in":["standard_ban_list_26_05","standard_balance_update_26_08"]},{"id":"big_deal","title":"Big Deal","side":"corp","type":"operation","faction":"haas_bioroid","printings":["33038"],"legal_in":["standard_ban_list_26_05","standard_balance_update_26_08"]},{"id":"bigger_picture","title":"Bigger Pictur